{
  "version": 4,
  "doc_type": "proposal",
  "criteria": [
    {
      "id": "R01",
      "title": "شناخت و شخصی‌سازی مشتری",
      "weight": 15,
      "judge_score": 3,
      "caps": [],
      "final_score": 3,
      "points": 11.25,
      "limited_by_input": false,
      "fix": "حجم درخواست‌ها و تاریخ جلسه‌ی کشف را از مدیر فروش بگیرید و در S03 بنویسید."
    },
    {
      "id": "R02",
      "title": "نتیجه و معیار سنجش",
      "weight": 10,
      "judge_score": 3,
      "caps": [],
      "final_score": 3,
      "points": 7.5,
      "limited_by_input": true,
      "fix": "پس از اندازه‌گیری مبنا در T-04 عدد هدف و مالک سنجش را با مدیر فروش نهایی و ثبت کنید."
    },
    {
      "id": "R03",
      "title": "دامنه و تحویل‌دادنی",
      "weight": 15,
      "judge_score": 3,
      "caps": [],
      "final_score": 3,
      "points": 11.25,
      "limited_by_input": false,
      "fix": "دسته‌ی محصول و قالب و محیط D-02 را از مدیر فروش بگیرید و در جدول تحویل‌ها بنویسید."
    },
    {
      "id": "R04",
      "title": "پذیرش و مدیریت تغییر",
      "weight": 10,
      "judge_score": 3,
      "caps": [],
      "final_score": 3,
      "points": 7.5,
      "limited_by_input": true,
      "fix": "تعداد بازنگری و بازه‌ی اصلاح را تعیین و تعریف خطای بحرانی را در D-01 تأیید کنید."
    },
    {
      "id": "R05",
      "title": "فرایند، زمان و نقش‌ها",
      "weight": 10,
      "judge_score": 2,
      "caps": [],
      "final_score": 2,
      "points": 5.0,
      "limited_by_input": true,
      "fix": "ظرفیت ساعتی بازبین و مدت هر مرحله را توافق و مسئول داده و مرجع اختلاف را نام‌گذاری کنید."
    },
    {
      "id": "R06",
      "title": "قیمت و شرایط تجاری",
      "weight": 15,
      "judge_score": 2,
      "caps": [
        {
          "max": 1,
          "source": "CHK-PAY-PERCENT",
          "detail": "جمع درصد پرداخت‌ها ۰ است، نه ۱۰۰"
        }
      ],
      "final_score": 1,
      "points": 3.75,
      "limited_by_input": true,
      "fix": "بودجه و مبنای قیمت را از مدیر فروش بگیرید و برآورد مبلغ، ارز، سقف و نقاط پرداخت وصل‌شده به پذیرش D-01 تا D-03 را بنویسید."
    },
    {
      "id": "R07",
      "title": "امنیت، فرض‌ها و ریسک",
      "weight": 10,
      "judge_score": 2,
      "caps": [],
      "final_score": 2,
      "points": 5.0,
      "limited_by_input": true,
      "fix": "پیش از تأیید دامنه مسئول داده را تعیین و مسیر داده و مالکیت خروجی‌ها را پر کنید."
    },
    {
      "id": "R08",
      "title": "proof و صداقت ادعا",
      "weight": 5,
      "judge_score": 2,
      "caps": [],
      "final_score": 2,
      "points": 2.5,
      "limited_by_input": true,
      "fix": "خروجی آزمون داخلی روی داده‌ی ساختگی را ضمیمه یا نمونه‌ی مرتبط با مجوز انتشار را معرفی کنید."
    },
    {
      "id": "R09",
      "title": "نگارش و طراحی و دسترس‌پذیری",
      "weight": 5,
      "judge_score": 3,
      "caps": [],
      "final_score": 3,
      "points": 3.75,
      "limited_by_input": false,
      "fix": "نامعلوم‌های تکراری را در یک جدول تجمیعی (U-) نگه دارید و در متن فقط ارجاع بدهید."
    },
    {
      "id": "R10",
      "title": "گام بعد و انطباق با دستور مشتری",
      "weight": 5,
      "judge_score": 3,
      "caps": [],
      "final_score": 3,
      "points": 3.75,
      "limited_by_input": false,
      "fix": "تاریخ دقیق «پایان ماه» و تاریخ سند را ثبت کنید."
    }
  ],
  "total": 61.25,
  "veto": [],
  "guide": {
    "pass": false,
    "band": "نیازمند بازتعریف پیشنهاد",
    "fail_reasons": [
      "total ۶۱٫۲۵ کمتر از حداقل ۸۵",
      "ردیف R06 (قیمت و شرایط تجاری) نمره‌ی ۱ دارد؛ حداقل ۲"
    ]
  },
  "target": {
    "met": false,
    "threshold": 90.0,
    "score10": 6.125
  },
  "issues": [
    {
      "source": "R06",
      "section": "S09",
      "points_at_stake": 11.25,
      "text": "R06 قیمت و شرایط تجاری: نمره ۱ از ۴. بودجه و مبنای قیمت را از مدیر فروش بگیرید و برآورد مبلغ، ارز، سقف و نقاط پرداخت وصل‌شده به پذیرش D-01 تا D-03 را بنویسید.؛ علت سقف: CHK-PAY-PERCENT ≤ ۱ (جمع درصد پرداخت‌ها ۰ است، نه ۱۰۰) (محدود به ورودی: بدون اطلاعات تازه بهتر نمی‌شود)",
      "severity": "critical",
      "id": "I-01"
    },
    {
      "source": "CHK-PAY-PERCENT",
      "severity": "critical",
      "section": "S09",
      "text": "CHK-PAY-PERCENT: جمع درصد پرداخت‌ها ۰ است، نه ۱۰۰",
      "points_at_stake": null,
      "id": "I-02"
    },
    {
      "source": "R05",
      "section": "S07",
      "points_at_stake": 5.0,
      "text": "R05 فرایند، زمان و نقش‌ها: نمره ۲ از ۴. ظرفیت ساعتی بازبین و مدت هر مرحله را توافق و مسئول داده و مرجع اختلاف را نام‌گذاری کنید. (محدود به ورودی: بدون اطلاعات تازه بهتر نمی‌شود)",
      "severity": "below_target",
      "id": "I-03"
    },
    {
      "source": "R07",
      "section": "S10",
      "points_at_stake": 5.0,
      "text": "R07 امنیت، فرض‌ها و ریسک: نمره ۲ از ۴. پیش از تأیید دامنه مسئول داده را تعیین و مسیر داده و مالکیت خروجی‌ها را پر کنید. (محدود به ورودی: بدون اطلاعات تازه بهتر نمی‌شود)",
      "severity": "below_target",
      "id": "I-04"
    },
    {
      "source": "R01",
      "section": "S02",
      "points_at_stake": 3.75,
      "text": "R01 شناخت و شخصی‌سازی مشتری: نمره ۳ از ۴. حجم درخواست‌ها و تاریخ جلسه‌ی کشف را از مدیر فروش بگیرید و در S03 بنویسید.",
      "severity": "below_target",
      "id": "I-05"
    },
    {
      "source": "R03",
      "section": "S05",
      "points_at_stake": 3.75,
      "text": "R03 دامنه و تحویل‌دادنی: نمره ۳ از ۴. دسته‌ی محصول و قالب و محیط D-02 را از مدیر فروش بگیرید و در جدول تحویل‌ها بنویسید.",
      "severity": "below_target",
      "id": "I-06"
    },
    {
      "source": "R02",
      "section": "S04",
      "points_at_stake": 2.5,
      "text": "R02 نتیجه و معیار سنجش: نمره ۳ از ۴. پس از اندازه‌گیری مبنا در T-04 عدد هدف و مالک سنجش را با مدیر فروش نهایی و ثبت کنید. (محدود به ورودی: بدون اطلاعات تازه بهتر نمی‌شود)",
      "severity": "below_target",
      "id": "I-07"
    },
    {
      "source": "R04",
      "section": "S10",
      "points_at_stake": 2.5,
      "text": "R04 پذیرش و مدیریت تغییر: نمره ۳ از ۴. تعداد بازنگری و بازه‌ی اصلاح را تعیین و تعریف خطای بحرانی را در D-01 تأیید کنید. (محدود به ورودی: بدون اطلاعات تازه بهتر نمی‌شود)",
      "severity": "below_target",
      "id": "I-08"
    },
    {
      "source": "R08",
      "section": "S14",
      "points_at_stake": 2.5,
      "text": "R08 proof و صداقت ادعا: نمره ۲ از ۴. خروجی آزمون داخلی روی داده‌ی ساختگی را ضمیمه یا نمونه‌ی مرتبط با مجوز انتشار را معرفی کنید. (محدود به ورودی: بدون اطلاعات تازه بهتر نمی‌شود)",
      "severity": "below_target",
      "id": "I-09"
    },
    {
      "source": "R09",
      "section": null,
      "points_at_stake": 1.25,
      "text": "R09 نگارش و طراحی و دسترس‌پذیری: نمره ۳ از ۴. نامعلوم‌های تکراری را در یک جدول تجمیعی (U-) نگه دارید و در متن فقط ارجاع بدهید.",
      "severity": "below_target",
      "id": "I-10"
    },
    {
      "source": "R10",
      "section": "S01",
      "points_at_stake": 1.25,
      "text": "R10 گام بعد و انطباق با دستور مشتری: نمره ۳ از ۴. تاریخ دقیق «پایان ماه» و تاریخ سند را ثبت کنید.",
      "severity": "below_target",
      "id": "I-11"
    },
    {
      "source": "CHK-LENGTH",
      "severity": "warn",
      "section": null,
      "text": "CHK-LENGTH: ۳۹۳۱ کلمه؛ بودجه ۱۰۰۰ تا ۳۲۰۰",
      "points_at_stake": null,
      "id": "I-12"
    }
  ],
  "judges_valid": false,
  "bottom_line": "سند صادق و خوش‌ساختار است، اما قیمت، مدت و مسیر داده کاملاً نامعلوم است و هیچ بخشی تأیید مالک ندارد.",
  "biggest_weakness": {
    "criterion": "R06",
    "what": "هیچ بودجه، مبلغ، سقف مصرف، ارز، مالیات یا نقطه‌ی پرداختی در سند نیست.",
    "why": "مدیر فروش نمی‌تواند هزینه را با منفعت مقایسه کند یا تصمیم شروع بگیرد، و آستانه‌ی قبولی روی قیمت ردیف اجباری است.",
    "fix": "بودجه و مبنای قیمت را بگیرید و برآورد مبلغ با سقف و پرداخت وصل به پذیرش تحویل‌ها بنویسید."
  }
}
