{
  "version": 2,
  "doc_type": "proposal",
  "criteria": [
    {
      "id": "R01",
      "title": "شناخت و شخصی‌سازی مشتری",
      "weight": 15,
      "judge_score": 3,
      "caps": [],
      "final_score": 3,
      "points": 11.25,
      "limited_by_input": false,
      "fix": "تاریخ جلسه‌ی کشف را ثبت کنید و پیش از ارسال دست‌کم برآورد تقریبی زمان بازبینی و حجم درخواست‌ها را از مدیر فروش بگیرید."
    },
    {
      "id": "R02",
      "title": "نتیجه و معیار سنجش",
      "weight": 10,
      "judge_score": 2,
      "caps": [],
      "final_score": 2,
      "points": 5.0,
      "limited_by_input": true,
      "fix": "مالک و ابزار ثبت زمان و برچسب اصلاح را پیش از تأیید D-01 تعیین کنید و قاعده‌ی توافق عدد هدف را با تاریخ بنویسید."
    },
    {
      "id": "R03",
      "title": "دامنه و تحویل‌دادنی",
      "weight": 15,
      "judge_score": 3,
      "caps": [],
      "final_score": 3,
      "points": 11.25,
      "limited_by_input": false,
      "fix": "دسته‌ی محصول را انتخاب کنید و قالب و موعد D-01 تا D-03 را در جدول بنویسید."
    },
    {
      "id": "R04",
      "title": "پذیرش و مدیریت تغییر",
      "weight": 10,
      "judge_score": 2,
      "caps": [],
      "final_score": 2,
      "points": 5.0,
      "limited_by_input": true,
      "fix": "دست‌کم تعریف خطای بحرانی و تعداد دور بازنگری را در همین سند بنویسید، نه فقط وعده‌ی سند بعدی."
    },
    {
      "id": "R05",
      "title": "فرایند، زمان و نقش‌ها",
      "weight": 10,
      "judge_score": 2,
      "caps": [],
      "final_score": 2,
      "points": 5.0,
      "limited_by_input": true,
      "fix": "برای هر مرحله دست‌کم بازه‌ی روز کاری بنویسید و مسئول داده و مسیر حل اختلاف را تعیین کنید."
    },
    {
      "id": "R06",
      "title": "قیمت و شرایط تجاری",
      "weight": 15,
      "judge_score": 2,
      "caps": [
        {
          "max": 1,
          "source": "CHK-PAY-PERCENT",
          "detail": "جمع درصد پرداخت‌ها ۰ است، نه ۱۰۰"
        }
      ],
      "final_score": 1,
      "points": 3.75,
      "limited_by_input": true,
      "fix": "مبنای قیمت را انتخاب کنید و دست‌کم یک برآورد با واحد و سقف برای P-01 و نقاط پرداخت وصل‌شده به A-01 تا A-03 بنویسید."
    },
    {
      "id": "R07",
      "title": "امنیت، فرض‌ها و ریسک",
      "weight": 10,
      "judge_score": 2,
      "caps": [],
      "final_score": 2,
      "points": 5.0,
      "limited_by_input": true,
      "fix": "به پرسش‌های مسیر داده در S11 پاسخ بدهید و برای K-01 تا K-03 مالک مشخص بنویسید."
    },
    {
      "id": "R08",
      "title": "proof و صداقت ادعا",
      "weight": 5,
      "judge_score": 2,
      "caps": [
        {
          "max": 1,
          "source": "judge-claims",
          "detail": "۱ ادعای unsupported: «نسخه‌ی ۱: بررسی دامنه، نه نهایی؛ قیمت نهایی نشده است.»"
        }
      ],
      "final_score": 1,
      "points": 1.25,
      "limited_by_input": true,
      "fix": "یک نمونه‌ی قابل بررسی با مجوز انتشار یا خروجی نمایشی نمونه‌ی آزمایشی اضافه کنید."
    },
    {
      "id": "R09",
      "title": "نگارش و طراحی و دسترس‌پذیری",
      "weight": 5,
      "judge_score": 3,
      "caps": [],
      "final_score": 3,
      "points": 3.75,
      "limited_by_input": false,
      "fix": "شماره‌ی نسخه را در جدول سرصفحه و S01 با نسخه‌ی واقعی یکی کنید و برچسب‌های تکراری نامعلوم را در جدول U جمع کنید."
    },
    {
      "id": "R10",
      "title": "گام بعد و انطباق با دستور مشتری",
      "weight": 5,
      "judge_score": 3,
      "caps": [],
      "final_score": 3,
      "points": 3.75,
      "limited_by_input": false,
      "fix": "تاریخ دقیق موعد تصمیم و تاریخ سند را بنویسید."
    }
  ],
  "total": 55.0,
  "veto": [],
  "guide": {
    "pass": false,
    "band": "نیازمند بازتعریف پیشنهاد",
    "fail_reasons": [
      "total ۵۵ کمتر از حداقل ۸۵",
      "ردیف حیاتی R04 (پذیرش و مدیریت تغییر) نمره‌ی ۲ دارد؛ حداقل ۳",
      "ردیف R06 (قیمت و شرایط تجاری) نمره‌ی ۱ دارد؛ حداقل ۲",
      "ردیف R08 (proof و صداقت ادعا) نمره‌ی ۱ دارد؛ حداقل ۲"
    ]
  },
  "target": {
    "met": false,
    "threshold": 90.0,
    "score10": 5.5
  },
  "issues": [
    {
      "source": "R06",
      "section": "S09",
      "points_at_stake": 11.25,
      "text": "R06 قیمت و شرایط تجاری: نمره ۱ از ۴. مبنای قیمت را انتخاب کنید و دست‌کم یک برآورد با واحد و سقف برای P-01 و نقاط پرداخت وصل‌شده به A-01 تا A-03 بنویسید.؛ علت سقف: CHK-PAY-PERCENT ≤ ۱ (جمع درصد پرداخت‌ها ۰ است، نه ۱۰۰) (محدود به ورودی: بدون اطلاعات تازه بهتر نمی‌شود)",
      "severity": "critical",
      "id": "I-01"
    },
    {
      "source": "R04",
      "section": "S10",
      "points_at_stake": 5.0,
      "text": "R04 پذیرش و مدیریت تغییر: نمره ۲ از ۴. دست‌کم تعریف خطای بحرانی و تعداد دور بازنگری را در همین سند بنویسید، نه فقط وعده‌ی سند بعدی. (محدود به ورودی: بدون اطلاعات تازه بهتر نمی‌شود)",
      "severity": "critical",
      "id": "I-02"
    },
    {
      "source": "CHK-PAY-PERCENT",
      "severity": "critical",
      "section": "S09",
      "text": "CHK-PAY-PERCENT: جمع درصد پرداخت‌ها ۰ است، نه ۱۰۰",
      "points_at_stake": null,
      "id": "I-03"
    },
    {
      "source": "R08",
      "section": "S14",
      "points_at_stake": 3.75,
      "text": "R08 proof و صداقت ادعا: نمره ۱ از ۴. یک نمونه‌ی قابل بررسی با مجوز انتشار یا خروجی نمایشی نمونه‌ی آزمایشی اضافه کنید.؛ علت سقف: judge-claims ≤ ۱ (۱ ادعای unsupported: «نسخه‌ی ۱: بررسی دامنه، نه نهایی؛ قیمت نهایی نشده است.») (محدود به ورودی: بدون اطلاعات تازه بهتر نمی‌شود)",
      "severity": "below_min",
      "id": "I-04"
    },
    {
      "source": "R02",
      "section": "S04",
      "points_at_stake": 5.0,
      "text": "R02 نتیجه و معیار سنجش: نمره ۲ از ۴. مالک و ابزار ثبت زمان و برچسب اصلاح را پیش از تأیید D-01 تعیین کنید و قاعده‌ی توافق عدد هدف را با تاریخ بنویسید. (محدود به ورودی: بدون اطلاعات تازه بهتر نمی‌شود)",
      "severity": "below_target",
      "id": "I-05"
    },
    {
      "source": "R05",
      "section": "S07",
      "points_at_stake": 5.0,
      "text": "R05 فرایند، زمان و نقش‌ها: نمره ۲ از ۴. برای هر مرحله دست‌کم بازه‌ی روز کاری بنویسید و مسئول داده و مسیر حل اختلاف را تعیین کنید. (محدود به ورودی: بدون اطلاعات تازه بهتر نمی‌شود)",
      "severity": "below_target",
      "id": "I-06"
    },
    {
      "source": "R07",
      "section": "S10",
      "points_at_stake": 5.0,
      "text": "R07 امنیت، فرض‌ها و ریسک: نمره ۲ از ۴. به پرسش‌های مسیر داده در S11 پاسخ بدهید و برای K-01 تا K-03 مالک مشخص بنویسید. (محدود به ورودی: بدون اطلاعات تازه بهتر نمی‌شود)",
      "severity": "below_target",
      "id": "I-07"
    },
    {
      "source": "R01",
      "section": "S02",
      "points_at_stake": 3.75,
      "text": "R01 شناخت و شخصی‌سازی مشتری: نمره ۳ از ۴. تاریخ جلسه‌ی کشف را ثبت کنید و پیش از ارسال دست‌کم برآورد تقریبی زمان بازبینی و حجم درخواست‌ها را از مدیر فروش بگیرید.",
      "severity": "below_target",
      "id": "I-08"
    },
    {
      "source": "R03",
      "section": "S05",
      "points_at_stake": 3.75,
      "text": "R03 دامنه و تحویل‌دادنی: نمره ۳ از ۴. دسته‌ی محصول را انتخاب کنید و قالب و موعد D-01 تا D-03 را در جدول بنویسید.",
      "severity": "below_target",
      "id": "I-09"
    },
    {
      "source": "R09",
      "section": null,
      "points_at_stake": 1.25,
      "text": "R09 نگارش و طراحی و دسترس‌پذیری: نمره ۳ از ۴. شماره‌ی نسخه را در جدول سرصفحه و S01 با نسخه‌ی واقعی یکی کنید و برچسب‌های تکراری نامعلوم را در جدول U جمع کنید.",
      "severity": "below_target",
      "id": "I-10"
    },
    {
      "source": "R10",
      "section": "S01",
      "points_at_stake": 1.25,
      "text": "R10 گام بعد و انطباق با دستور مشتری: نمره ۳ از ۴. تاریخ دقیق موعد تصمیم و تاریخ سند را بنویسید.",
      "severity": "below_target",
      "id": "I-11"
    },
    {
      "source": "CHK-DIGITS",
      "severity": "warn",
      "section": null,
      "text": "CHK-DIGITS: عدد غیرفارسی در 1 فیلد",
      "points_at_stake": null,
      "id": "I-12"
    },
    {
      "source": "CHK-LENGTH",
      "severity": "warn",
      "section": null,
      "text": "CHK-LENGTH: ۴۲۰۹ کلمه؛ بودجه ۱۰۰۰ تا ۳۲۰۰",
      "points_at_stake": null,
      "id": "I-13"
    }
  ],
  "judges_valid": false,
  "bottom_line": "سند صادق و خوش‌ساختار است، ولی قیمت، زمان و آستانه‌های پذیرش بیشترشان نامعلوم است و هنوز چیزی برای امضا ندارد.",
  "biggest_weakness": {
    "criterion": "R06",
    "what": "هیچ مبلغ، مبنای قیمت، واحد یا نقطه‌ی پرداخت در سند نیست.",
    "why": "مدیر فروش نمی‌تواند هزینه را با منفعت مقایسه کند و بدون قیمت درباره‌ی شروع پایلوت تصمیم بگیرد؛ وزن این ردیف ۱۵ است.",
    "fix": "مبنای قیمت را انتخاب و برآورد با واحد، سقف مصرف و نقاط پرداخت وصل‌شده به A-01 تا A-03 را اضافه کنید."
  }
}
