{
  "version": 3,
  "doc_type": "proposal",
  "criteria": [
    {
      "id": "R01",
      "title": "شناخت و شخصی‌سازی مشتری",
      "weight": 15,
      "judge_score": 3,
      "caps": [],
      "final_score": 3,
      "points": 11.25,
      "limited_by_input": false,
      "fix": "حجم درخواست‌ها و نرخ اصلاح فعلی را از مدیر فروش بگیرید و در بخش تشخیص بنویسید."
    },
    {
      "id": "R02",
      "title": "نتیجه و معیار سنجش",
      "weight": 10,
      "judge_score": 3,
      "caps": [],
      "final_score": 3,
      "points": 7.5,
      "limited_by_input": true,
      "fix": "مالک و ابزار ثبت را در جلسه‌ی تأیید دامنه (U-07) از مدیر فروش تأیید بگیرید."
    },
    {
      "id": "R03",
      "title": "دامنه و تحویل‌دادنی",
      "weight": 15,
      "judge_score": 3,
      "caps": [],
      "final_score": 3,
      "points": 11.25,
      "limited_by_input": true,
      "fix": "دسته‌ی محصول را انتخاب و قالب و موعد D-01 تا D-03 را در سند قیمت و برنامه ثابت کنید."
    },
    {
      "id": "R04",
      "title": "پذیرش و مدیریت تغییر",
      "weight": 10,
      "judge_score": 3,
      "caps": [],
      "final_score": 3,
      "points": 7.5,
      "limited_by_input": true,
      "fix": "تعریف بازنگری و تعداد آن (U-17) و بازه‌ی اصلاح ایراد (U-21) را با مدیر فروش نهایی کنید."
    },
    {
      "id": "R05",
      "title": "فرایند، زمان و نقش‌ها",
      "weight": 10,
      "judge_score": 2,
      "caps": [],
      "final_score": 2,
      "points": 5.0,
      "limited_by_input": true,
      "fix": "ظرفیت ساعتی بازبین و مسئول داده را تعیین کنید و مدت هر مرحله را برآورد کنید."
    },
    {
      "id": "R06",
      "title": "قیمت و شرایط تجاری",
      "weight": 15,
      "judge_score": 2,
      "caps": [
        {
          "max": 1,
          "source": "CHK-PAY-PERCENT",
          "detail": "جمع درصد پرداخت‌ها ۰ است، نه ۱۰۰"
        }
      ],
      "final_score": 1,
      "points": 3.75,
      "limited_by_input": true,
      "fix": "یک بازه‌ی برآوردی یا مبنای محاسبه (قیمت ثابت یا زمان با سقف) و نقاط پرداخت وصل‌شده به D-01 تا D-03 تعیین و مالک تأیید کند."
    },
    {
      "id": "R07",
      "title": "امنیت، فرض‌ها و ریسک",
      "weight": 10,
      "judge_score": 2,
      "caps": [],
      "final_score": 2,
      "points": 5.0,
      "limited_by_input": true,
      "fix": "مسئول داده‌ی مشتری را تعیین کنید تا محل پردازش، نگهداری، حذف و مسیر رخداد پیش از شروع پاسخ داده شود."
    },
    {
      "id": "R08",
      "title": "proof و صداقت ادعا",
      "weight": 5,
      "judge_score": 2,
      "caps": [
        {
          "max": 1,
          "source": "judge-claims",
          "detail": "۱ ادعای unsupported: «در پایلوت فقط نمونه‌ی ناشناس‌شده‌ی درخواست‌های قیمت استفاده »"
        }
      ],
      "final_score": 1,
      "points": 1.25,
      "limited_by_input": true,
      "fix": "خروجی آزمون داخلی روی داده‌ی ساختگی را ضمیمه کنید یا نمونه‌ای با مجوز انتشار بیاورید."
    },
    {
      "id": "R09",
      "title": "نگارش و طراحی و دسترس‌پذیری",
      "weight": 5,
      "judge_score": 3,
      "caps": [],
      "final_score": 3,
      "points": 3.75,
      "limited_by_input": false,
      "fix": "در متن اصلی ارجاع‌های U و C را کم کنید و نامعلوم‌های تکراری را به جدول U-ها بسپارید."
    },
    {
      "id": "R10",
      "title": "گام بعد و انطباق با دستور مشتری",
      "weight": 5,
      "judge_score": 3,
      "caps": [],
      "final_score": 3,
      "points": 3.75,
      "limited_by_input": false,
      "fix": "تاریخ دقیق «پایان ماه» را (U-24) بنویسید."
    }
  ],
  "total": 60.0,
  "veto": [],
  "guide": {
    "pass": false,
    "band": "نیازمند بازتعریف پیشنهاد",
    "fail_reasons": [
      "total ۶۰ کمتر از حداقل ۸۵",
      "ردیف R06 (قیمت و شرایط تجاری) نمره‌ی ۱ دارد؛ حداقل ۲",
      "ردیف R08 (proof و صداقت ادعا) نمره‌ی ۱ دارد؛ حداقل ۲"
    ]
  },
  "target": {
    "met": false,
    "threshold": 90.0,
    "score10": 6.0
  },
  "issues": [
    {
      "source": "R06",
      "section": "S09",
      "points_at_stake": 11.25,
      "text": "R06 قیمت و شرایط تجاری: نمره ۱ از ۴. یک بازه‌ی برآوردی یا مبنای محاسبه (قیمت ثابت یا زمان با سقف) و نقاط پرداخت وصل‌شده به D-01 تا D-03 تعیین و مالک تأیید کند.؛ علت سقف: CHK-PAY-PERCENT ≤ ۱ (جمع درصد پرداخت‌ها ۰ است، نه ۱۰۰) (محدود به ورودی: بدون اطلاعات تازه بهتر نمی‌شود)",
      "severity": "critical",
      "id": "I-01"
    },
    {
      "source": "CHK-PAY-PERCENT",
      "severity": "critical",
      "section": "S09",
      "text": "CHK-PAY-PERCENT: جمع درصد پرداخت‌ها ۰ است، نه ۱۰۰",
      "points_at_stake": null,
      "id": "I-02"
    },
    {
      "source": "R08",
      "section": "S14",
      "points_at_stake": 3.75,
      "text": "R08 proof و صداقت ادعا: نمره ۱ از ۴. خروجی آزمون داخلی روی داده‌ی ساختگی را ضمیمه کنید یا نمونه‌ای با مجوز انتشار بیاورید.؛ علت سقف: judge-claims ≤ ۱ (۱ ادعای unsupported: «در پایلوت فقط نمونه‌ی ناشناس‌شده‌ی درخواست‌های قیمت استفاده ») (محدود به ورودی: بدون اطلاعات تازه بهتر نمی‌شود)",
      "severity": "below_min",
      "id": "I-03"
    },
    {
      "source": "R05",
      "section": "S07",
      "points_at_stake": 5.0,
      "text": "R05 فرایند، زمان و نقش‌ها: نمره ۲ از ۴. ظرفیت ساعتی بازبین و مسئول داده را تعیین کنید و مدت هر مرحله را برآورد کنید. (محدود به ورودی: بدون اطلاعات تازه بهتر نمی‌شود)",
      "severity": "below_target",
      "id": "I-04"
    },
    {
      "source": "R07",
      "section": "S10",
      "points_at_stake": 5.0,
      "text": "R07 امنیت، فرض‌ها و ریسک: نمره ۲ از ۴. مسئول داده‌ی مشتری را تعیین کنید تا محل پردازش، نگهداری، حذف و مسیر رخداد پیش از شروع پاسخ داده شود. (محدود به ورودی: بدون اطلاعات تازه بهتر نمی‌شود)",
      "severity": "below_target",
      "id": "I-05"
    },
    {
      "source": "R01",
      "section": "S02",
      "points_at_stake": 3.75,
      "text": "R01 شناخت و شخصی‌سازی مشتری: نمره ۳ از ۴. حجم درخواست‌ها و نرخ اصلاح فعلی را از مدیر فروش بگیرید و در بخش تشخیص بنویسید.",
      "severity": "below_target",
      "id": "I-06"
    },
    {
      "source": "R03",
      "section": "S05",
      "points_at_stake": 3.75,
      "text": "R03 دامنه و تحویل‌دادنی: نمره ۳ از ۴. دسته‌ی محصول را انتخاب و قالب و موعد D-01 تا D-03 را در سند قیمت و برنامه ثابت کنید. (محدود به ورودی: بدون اطلاعات تازه بهتر نمی‌شود)",
      "severity": "below_target",
      "id": "I-07"
    },
    {
      "source": "R02",
      "section": "S04",
      "points_at_stake": 2.5,
      "text": "R02 نتیجه و معیار سنجش: نمره ۳ از ۴. مالک و ابزار ثبت را در جلسه‌ی تأیید دامنه (U-07) از مدیر فروش تأیید بگیرید. (محدود به ورودی: بدون اطلاعات تازه بهتر نمی‌شود)",
      "severity": "below_target",
      "id": "I-08"
    },
    {
      "source": "R04",
      "section": "S10",
      "points_at_stake": 2.5,
      "text": "R04 پذیرش و مدیریت تغییر: نمره ۳ از ۴. تعریف بازنگری و تعداد آن (U-17) و بازه‌ی اصلاح ایراد (U-21) را با مدیر فروش نهایی کنید. (محدود به ورودی: بدون اطلاعات تازه بهتر نمی‌شود)",
      "severity": "below_target",
      "id": "I-09"
    },
    {
      "source": "R09",
      "section": null,
      "points_at_stake": 1.25,
      "text": "R09 نگارش و طراحی و دسترس‌پذیری: نمره ۳ از ۴. در متن اصلی ارجاع‌های U و C را کم کنید و نامعلوم‌های تکراری را به جدول U-ها بسپارید.",
      "severity": "below_target",
      "id": "I-10"
    },
    {
      "source": "R10",
      "section": "S01",
      "points_at_stake": 1.25,
      "text": "R10 گام بعد و انطباق با دستور مشتری: نمره ۳ از ۴. تاریخ دقیق «پایان ماه» را (U-24) بنویسید.",
      "severity": "below_target",
      "id": "I-11"
    },
    {
      "source": "CHK-LENGTH",
      "severity": "warn",
      "section": null,
      "text": "CHK-LENGTH: ۴۷۹۷ کلمه؛ بودجه ۱۰۰۰ تا ۳۲۰۰",
      "points_at_stake": null,
      "id": "I-12"
    }
  ],
  "judges_valid": false,
  "bottom_line": "ساختار و صداقت ادعا خوب است، اما بخش‌های قیمت، زمان‌بندی و امنیت عملاً خالی‌اند و سند هنوز چیزی نیست که مشتری بتواند امضا یا مقایسه کند.",
  "biggest_weakness": {
    "criterion": "R06",
    "what": "هیچ مبلغ، مبنای قیمت، واحد یا نقطه‌ی پرداختی وجود ندارد و جمع‌ها نامعلوم‌اند.",
    "why": "مدیر فروش بدون هزینه نمی‌تواند تصمیم شروع بگیرد و ردیف قیمت زیر آستانه‌ی دروازه می‌ماند.",
    "fix": "بازه‌ی بودجه یا مبنای محاسبه را با مدیر فروش تعیین و نقاط پرداخت را به پذیرش D-01 تا D-03 وصل کنید."
  }
}
