{
  "version": 1,
  "doc_type": "proposal",
  "criteria": [
    {
      "id": "R01",
      "title": "شناخت و شخصی‌سازی مشتری",
      "weight": 15,
      "judge_score": 3,
      "caps": [],
      "final_score": 3,
      "points": 11.25,
      "limited_by_input": false,
      "fix": "زمان میانه‌ی بازبینی، حجم درخواست‌ها و تاریخ جلسه‌ی کشف را از مدیر فروش بگیرید و در S03 بنویسید."
    },
    {
      "id": "R02",
      "title": "نتیجه و معیار سنجش",
      "weight": 10,
      "judge_score": 2,
      "caps": [],
      "final_score": 2,
      "points": 5.0,
      "limited_by_input": true,
      "fix": "مالک و ابزار ثبت هر شاخص را تعیین کنید و مدت دوره‌ی سنجش را بنویسید؛ هدف پس از مبنا بماند."
    },
    {
      "id": "R03",
      "title": "دامنه و تحویل‌دادنی",
      "weight": 15,
      "judge_score": 3,
      "caps": [],
      "final_score": 3,
      "points": 11.25,
      "limited_by_input": false,
      "fix": "دسته‌ی محصول و قالب و موعد D-01 تا D-03 را از مدیر فروش و تیم مجری بگیرید و در جدول بنویسید."
    },
    {
      "id": "R04",
      "title": "پذیرش و مدیریت تغییر",
      "weight": 10,
      "judge_score": 3,
      "caps": [],
      "final_score": 3,
      "points": 7.5,
      "limited_by_input": false,
      "fix": "تعریف خطای بحرانی، روش ثبت ایراد و تعداد بازنگری را در سند توافق بعدی مشخص کنید."
    },
    {
      "id": "R05",
      "title": "فرایند، زمان و نقش‌ها",
      "weight": 10,
      "judge_score": 2,
      "caps": [],
      "final_score": 2,
      "points": 5.0,
      "limited_by_input": true,
      "fix": "مدت هر مرحله را برآورد کنید و نام یا نقش بازبین، مسئول داده و مرجع اختلاف را تعیین کنید."
    },
    {
      "id": "R06",
      "title": "قیمت و شرایط تجاری",
      "weight": 15,
      "judge_score": 2,
      "caps": [
        {
          "max": 1,
          "source": "CHK-PAY-PERCENT",
          "detail": "جمع درصد پرداخت‌ها ۰ است، نه ۱۰۰"
        }
      ],
      "final_score": 1,
      "points": 3.75,
      "limited_by_input": true,
      "fix": "بودجه و مبنای قیمت (ثابت یا زمان با سقف)، واحد، مالیات و نقاط پرداخت را تعیین و به تحویل‌ها وصل کنید."
    },
    {
      "id": "R07",
      "title": "امنیت، فرض‌ها و ریسک",
      "weight": 10,
      "judge_score": 2,
      "caps": [],
      "final_score": 2,
      "points": 5.0,
      "limited_by_input": true,
      "fix": "مسیر داده (محل پردازش، سرویس ثالث، نگهداری، حذف، دسترسی) را با مسئول داده پر کنید و برای K-01 تا K-03 مالک بنویسید."
    },
    {
      "id": "R08",
      "title": "proof و صداقت ادعا",
      "weight": 5,
      "judge_score": 2,
      "caps": [
        {
          "max": 1,
          "source": "judge-claims",
          "detail": "۱ ادعای unsupported: «قیمت پکیج‌های منتشرشده‌ی مهدیار هوش‌افزا قدیمی و نیازمند تأی»"
        }
      ],
      "final_score": 1,
      "points": 1.25,
      "limited_by_input": true,
      "fix": "یک نمونه‌ی مرتبط قابل بررسی با مجوز انتشار اضافه کنید، یا خروجی آزمون داخلی روی داده‌ی ساختگی را ضمیمه کنید."
    },
    {
      "id": "R09",
      "title": "نگارش و طراحی و دسترس‌پذیری",
      "weight": 5,
      "judge_score": 3,
      "caps": [],
      "final_score": 3,
      "points": 3.75,
      "limited_by_input": false,
      "fix": "نامعلوم‌های تکراری را در جدول S15 متمرکز کنید و در متن اصلی فقط به شناسه‌ی U ارجاع دهید."
    },
    {
      "id": "R10",
      "title": "گام بعد و انطباق با دستور مشتری",
      "weight": 5,
      "judge_score": 3,
      "caps": [],
      "final_score": 3,
      "points": 3.75,
      "limited_by_input": false,
      "fix": "تاریخ دقیق «پایان ماه» و تاریخ سند را بنویسید."
    }
  ],
  "total": 57.5,
  "veto": [],
  "guide": {
    "pass": false,
    "band": "نیازمند بازتعریف پیشنهاد",
    "fail_reasons": [
      "total ۵۷٫۵ کمتر از حداقل ۸۵",
      "ردیف R06 (قیمت و شرایط تجاری) نمره‌ی ۱ دارد؛ حداقل ۲",
      "ردیف R08 (proof و صداقت ادعا) نمره‌ی ۱ دارد؛ حداقل ۲"
    ]
  },
  "target": {
    "met": false,
    "threshold": 90.0,
    "score10": 5.75
  },
  "issues": [
    {
      "source": "R06",
      "section": "S09",
      "points_at_stake": 11.25,
      "text": "R06 قیمت و شرایط تجاری: نمره ۱ از ۴. بودجه و مبنای قیمت (ثابت یا زمان با سقف)، واحد، مالیات و نقاط پرداخت را تعیین و به تحویل‌ها وصل کنید.؛ علت سقف: CHK-PAY-PERCENT ≤ ۱ (جمع درصد پرداخت‌ها ۰ است، نه ۱۰۰) (محدود به ورودی: بدون اطلاعات تازه بهتر نمی‌شود)",
      "severity": "critical",
      "id": "I-01"
    },
    {
      "source": "CHK-PAY-PERCENT",
      "severity": "critical",
      "section": "S09",
      "text": "CHK-PAY-PERCENT: جمع درصد پرداخت‌ها ۰ است، نه ۱۰۰",
      "points_at_stake": null,
      "id": "I-02"
    },
    {
      "source": "R08",
      "section": "S14",
      "points_at_stake": 3.75,
      "text": "R08 proof و صداقت ادعا: نمره ۱ از ۴. یک نمونه‌ی مرتبط قابل بررسی با مجوز انتشار اضافه کنید، یا خروجی آزمون داخلی روی داده‌ی ساختگی را ضمیمه کنید.؛ علت سقف: judge-claims ≤ ۱ (۱ ادعای unsupported: «قیمت پکیج‌های منتشرشده‌ی مهدیار هوش‌افزا قدیمی و نیازمند تأی») (محدود به ورودی: بدون اطلاعات تازه بهتر نمی‌شود)",
      "severity": "below_min",
      "id": "I-03"
    },
    {
      "source": "R02",
      "section": "S04",
      "points_at_stake": 5.0,
      "text": "R02 نتیجه و معیار سنجش: نمره ۲ از ۴. مالک و ابزار ثبت هر شاخص را تعیین کنید و مدت دوره‌ی سنجش را بنویسید؛ هدف پس از مبنا بماند. (محدود به ورودی: بدون اطلاعات تازه بهتر نمی‌شود)",
      "severity": "below_target",
      "id": "I-04"
    },
    {
      "source": "R05",
      "section": "S07",
      "points_at_stake": 5.0,
      "text": "R05 فرایند، زمان و نقش‌ها: نمره ۲ از ۴. مدت هر مرحله را برآورد کنید و نام یا نقش بازبین، مسئول داده و مرجع اختلاف را تعیین کنید. (محدود به ورودی: بدون اطلاعات تازه بهتر نمی‌شود)",
      "severity": "below_target",
      "id": "I-05"
    },
    {
      "source": "R07",
      "section": "S10",
      "points_at_stake": 5.0,
      "text": "R07 امنیت، فرض‌ها و ریسک: نمره ۲ از ۴. مسیر داده (محل پردازش، سرویس ثالث، نگهداری، حذف، دسترسی) را با مسئول داده پر کنید و برای K-01 تا K-03 مالک بنویسید. (محدود به ورودی: بدون اطلاعات تازه بهتر نمی‌شود)",
      "severity": "below_target",
      "id": "I-06"
    },
    {
      "source": "R01",
      "section": "S02",
      "points_at_stake": 3.75,
      "text": "R01 شناخت و شخصی‌سازی مشتری: نمره ۳ از ۴. زمان میانه‌ی بازبینی، حجم درخواست‌ها و تاریخ جلسه‌ی کشف را از مدیر فروش بگیرید و در S03 بنویسید.",
      "severity": "below_target",
      "id": "I-07"
    },
    {
      "source": "R03",
      "section": "S05",
      "points_at_stake": 3.75,
      "text": "R03 دامنه و تحویل‌دادنی: نمره ۳ از ۴. دسته‌ی محصول و قالب و موعد D-01 تا D-03 را از مدیر فروش و تیم مجری بگیرید و در جدول بنویسید.",
      "severity": "below_target",
      "id": "I-08"
    },
    {
      "source": "R04",
      "section": "S10",
      "points_at_stake": 2.5,
      "text": "R04 پذیرش و مدیریت تغییر: نمره ۳ از ۴. تعریف خطای بحرانی، روش ثبت ایراد و تعداد بازنگری را در سند توافق بعدی مشخص کنید.",
      "severity": "below_target",
      "id": "I-09"
    },
    {
      "source": "R09",
      "section": null,
      "points_at_stake": 1.25,
      "text": "R09 نگارش و طراحی و دسترس‌پذیری: نمره ۳ از ۴. نامعلوم‌های تکراری را در جدول S15 متمرکز کنید و در متن اصلی فقط به شناسه‌ی U ارجاع دهید.",
      "severity": "below_target",
      "id": "I-10"
    },
    {
      "source": "R10",
      "section": "S01",
      "points_at_stake": 1.25,
      "text": "R10 گام بعد و انطباق با دستور مشتری: نمره ۳ از ۴. تاریخ دقیق «پایان ماه» و تاریخ سند را بنویسید.",
      "severity": "below_target",
      "id": "I-11"
    },
    {
      "source": "CHK-LENGTH",
      "severity": "warn",
      "section": null,
      "text": "CHK-LENGTH: ۴۴۰۰ کلمه؛ بودجه ۱۰۰۰ تا ۳۲۰۰",
      "points_at_stake": null,
      "id": "I-12"
    }
  ],
  "judges_valid": false,
  "bottom_line": "سند صادق و خوش‌ساختار است ولی قیمت، مدت، مبنا و هدف همه نامعلوم‌اند و هنوز پیشنهاد قابل تصمیم برای مشتری نیست.",
  "biggest_weakness": {
    "criterion": "R06",
    "what": "هیچ بودجه، قیمت، واحد، مالیات یا نقطه‌ی پرداختی وجود ندارد.",
    "why": "مدیر فروش نمی‌تواند هزینه را با منفعت یا گزینه‌ای دیگر مقایسه کند و دروازه‌ی حداقل نمره‌ی قیمت پر نمی‌شود.",
    "fix": "بودجه و مبنای قیمت را از مدیر فروش و تیم مجری بگیرید و اقلام P-01 و P-02 را با واحد، مالیات و پرداخت مرتبط با D-01 تا D-03 بنویسید."
  }
}
