{
  "version": 1,
  "doc_type": "proposal",
  "criteria": [
    {
      "id": "R01",
      "title": "شناخت و شخصی‌سازی مشتری",
      "weight": 15,
      "judge_score": 3,
      "caps": [],
      "final_score": 3,
      "points": 11.25,
      "limited_by_input": false,
      "fix": "در S03 حجم تقریبی پیش‌نویس‌ها و تعداد بازبین‌ها را با منبع بنویسید یا صریح نامعلوم اعلام کنید."
    },
    {
      "id": "R02",
      "title": "نتیجه و معیار سنجش",
      "weight": 10,
      "judge_score": 3,
      "caps": [],
      "final_score": 3,
      "points": 7.5,
      "limited_by_input": false,
      "fix": "پیش از نهایی‌شدن، مالک فروش شاخص‌ها و فرمول‌ها را کتبی تأیید کند و بازه‌ی زمانی توافق هدف را بنویسید."
    },
    {
      "id": "R03",
      "title": "دامنه و تحویل‌دادنی",
      "weight": 15,
      "judge_score": 3,
      "caps": [],
      "final_score": 3,
      "points": 11.25,
      "limited_by_input": false,
      "fix": "تعداد نمونه‌های مجموعه‌ی آزمون را در D-01 بنویسید و در S05 یک جمله درباره‌ی گزینه‌ی ردشده اضافه کنید."
    },
    {
      "id": "R04",
      "title": "پذیرش و مدیریت تغییر",
      "weight": 10,
      "judge_score": 3,
      "caps": [],
      "final_score": 3,
      "points": 7.5,
      "limited_by_input": false,
      "fix": "برای A-03 خطای بحرانی و داده‌ی سناریو را تعریف کنید و تاریخ توافق آستانه‌ی A-02 را بنویسید."
    },
    {
      "id": "R05",
      "title": "فرایند، زمان و نقش‌ها",
      "weight": 10,
      "judge_score": 3,
      "caps": [],
      "final_score": 3,
      "points": 7.5,
      "limited_by_input": false,
      "fix": "یک سطر مسیر ارجاع اختلاف اضافه کنید و برای آموزش و تحویل، زمان پاسخ مسئول عملیات فروش را بنویسید."
    },
    {
      "id": "R06",
      "title": "قیمت و شرایط تجاری",
      "weight": 15,
      "judge_score": 3,
      "caps": [],
      "final_score": 3,
      "points": 11.25,
      "limited_by_input": false,
      "fix": "سقف مصرف API را عددی کنید و مشخص کنید PAY-01 روی کدام قیمت نهایی محاسبه می‌شود."
    },
    {
      "id": "R07",
      "title": "امنیت، فرض‌ها و ریسک",
      "weight": 10,
      "judge_score": 3,
      "caps": [],
      "final_score": 3,
      "points": 7.5,
      "limited_by_input": false,
      "fix": "در S11 دسته‌ی داده و پردازشگر (پس از تأیید U-01) و مسیر گزارش رخداد را بنویسید و به ریسک‌ها احتمال بدهید."
    },
    {
      "id": "R08",
      "title": "proof و صداقت ادعا",
      "weight": 5,
      "judge_score": 2,
      "caps": [],
      "final_score": 2,
      "points": 2.5,
      "limited_by_input": false,
      "fix": "نمونه را با نام و شرح خروجی مشخص کنید، تیم مجری و نقش‌ها را بنویسید و محدودیت تجربه را صریح اعلام کنید."
    },
    {
      "id": "R09",
      "title": "نگارش و طراحی و دسترس‌پذیری",
      "weight": 5,
      "judge_score": 3,
      "caps": [],
      "final_score": 3,
      "points": 3.75,
      "limited_by_input": false,
      "fix": "در S02 کلمه‌ی «اختیاری» را کنار پشتیبانی ماهانه بیفزایید و جمله‌های طولانی را کوتاه کنید."
    },
    {
      "id": "R10",
      "title": "گام بعد و انطباق با دستور مشتری",
      "weight": 5,
      "judge_score": 3,
      "caps": [],
      "final_score": 3,
      "points": 3.75,
      "limited_by_input": false,
      "fix": "موعد تأیید دامنه را با مدیر فروش هماهنگ کنید و تأیید او را در وضعیت سند ثبت کنید."
    }
  ],
  "total": 73.75,
  "veto": [],
  "guide": {
    "pass": false,
    "band": "نیازمند اصلاح",
    "fail_reasons": [
      "total ۷۳٫۷۵ کمتر از حداقل ۸۵"
    ]
  },
  "target": {
    "met": false,
    "threshold": 90.0,
    "score10": 7.375
  },
  "issues": [
    {
      "source": "R01",
      "section": "S02",
      "points_at_stake": 3.75,
      "text": "R01 شناخت و شخصی‌سازی مشتری: نمره ۳ از ۴. در S03 حجم تقریبی پیش‌نویس‌ها و تعداد بازبین‌ها را با منبع بنویسید یا صریح نامعلوم اعلام کنید.",
      "severity": "below_target",
      "id": "I-01"
    },
    {
      "source": "R03",
      "section": "S05",
      "points_at_stake": 3.75,
      "text": "R03 دامنه و تحویل‌دادنی: نمره ۳ از ۴. تعداد نمونه‌های مجموعه‌ی آزمون را در D-01 بنویسید و در S05 یک جمله درباره‌ی گزینه‌ی ردشده اضافه کنید.",
      "severity": "below_target",
      "id": "I-02"
    },
    {
      "source": "R06",
      "section": "S09",
      "points_at_stake": 3.75,
      "text": "R06 قیمت و شرایط تجاری: نمره ۳ از ۴. سقف مصرف API را عددی کنید و مشخص کنید PAY-01 روی کدام قیمت نهایی محاسبه می‌شود.",
      "severity": "below_target",
      "id": "I-03"
    },
    {
      "source": "R02",
      "section": "S04",
      "points_at_stake": 2.5,
      "text": "R02 نتیجه و معیار سنجش: نمره ۳ از ۴. پیش از نهایی‌شدن، مالک فروش شاخص‌ها و فرمول‌ها را کتبی تأیید کند و بازه‌ی زمانی توافق هدف را بنویسید.",
      "severity": "below_target",
      "id": "I-04"
    },
    {
      "source": "R04",
      "section": "S10",
      "points_at_stake": 2.5,
      "text": "R04 پذیرش و مدیریت تغییر: نمره ۳ از ۴. برای A-03 خطای بحرانی و داده‌ی سناریو را تعریف کنید و تاریخ توافق آستانه‌ی A-02 را بنویسید.",
      "severity": "below_target",
      "id": "I-05"
    },
    {
      "source": "R05",
      "section": "S07",
      "points_at_stake": 2.5,
      "text": "R05 فرایند، زمان و نقش‌ها: نمره ۳ از ۴. یک سطر مسیر ارجاع اختلاف اضافه کنید و برای آموزش و تحویل، زمان پاسخ مسئول عملیات فروش را بنویسید.",
      "severity": "below_target",
      "id": "I-06"
    },
    {
      "source": "R07",
      "section": "S10",
      "points_at_stake": 2.5,
      "text": "R07 امنیت، فرض‌ها و ریسک: نمره ۳ از ۴. در S11 دسته‌ی داده و پردازشگر (پس از تأیید U-01) و مسیر گزارش رخداد را بنویسید و به ریسک‌ها احتمال بدهید.",
      "severity": "below_target",
      "id": "I-07"
    },
    {
      "source": "R08",
      "section": "S14",
      "points_at_stake": 2.5,
      "text": "R08 proof و صداقت ادعا: نمره ۲ از ۴. نمونه را با نام و شرح خروجی مشخص کنید، تیم مجری و نقش‌ها را بنویسید و محدودیت تجربه را صریح اعلام کنید.",
      "severity": "below_target",
      "id": "I-08"
    },
    {
      "source": "R09",
      "section": null,
      "points_at_stake": 1.25,
      "text": "R09 نگارش و طراحی و دسترس‌پذیری: نمره ۳ از ۴. در S02 کلمه‌ی «اختیاری» را کنار پشتیبانی ماهانه بیفزایید و جمله‌های طولانی را کوتاه کنید.",
      "severity": "below_target",
      "id": "I-09"
    },
    {
      "source": "R10",
      "section": "S01",
      "points_at_stake": 1.25,
      "text": "R10 گام بعد و انطباق با دستور مشتری: نمره ۳ از ۴. موعد تأیید دامنه را با مدیر فروش هماهنگ کنید و تأیید او را در وضعیت سند ثبت کنید.",
      "severity": "below_target",
      "id": "I-10"
    }
  ],
  "judges_valid": false,
  "bottom_line": "سند از نظر ساختار و صداقت قوی و همه‌ی ردیف‌ها پر است، اما هیچ بخشی تأیید مالک را ندارد و بخش توان اجرا عملاً خالی از شاهد قابل بررسی است.",
  "biggest_weakness": {
    "criterion": "R08",
    "what": "نمونه‌ی مرتبط بدون نام و شرح آمده و تیم یا سابقه‌ای معرفی نشده است.",
    "why": "خواننده نمی‌تواند توان اجرا را بسنجد و ادعا فقط به یک جمله‌ی بی‌جزئیات متکی است.",
    "fix": "نمونه را نام ببرید و خروجی آن را شرح دهید، تیم مجری را معرفی کنید و محدودیت تجربه را بنویسید."
  }
}
