{
  "version": 1,
  "doc_type": "proposal",
  "criteria": [
    {
      "id": "R01",
      "title": "شناخت و شخصی‌سازی مشتری",
      "weight": 15,
      "judge_score": 3,
      "caps": [],
      "final_score": 3,
      "points": 11.25,
      "limited_by_input": false,
      "fix": "در S03 حجم تقریبی پیش‌نویس‌ها و تعداد بازبین‌ها را از صورت‌جلسه بیاورید، یا صریحاً نامعلوم بنویسید و در پیوست نامعلوم‌ها ثبت کنید."
    },
    {
      "id": "R02",
      "title": "نتیجه و معیار سنجش",
      "weight": 10,
      "judge_score": 3,
      "caps": [],
      "final_score": 3,
      "points": 7.5,
      "limited_by_input": false,
      "fix": "حداقل تعداد پیش‌نویس برای محاسبه‌ی میانه و موعد توافق هدف (مثلاً پایان T-01) را در جدول شاخص‌ها اضافه کنید."
    },
    {
      "id": "R03",
      "title": "دامنه و تحویل‌دادنی",
      "weight": 15,
      "judge_score": 3,
      "caps": [],
      "final_score": 3,
      "points": 11.25,
      "limited_by_input": false,
      "fix": "تعداد نمونه‌های مجموعه‌ی آزمون را در D-01 بنویسید، جریان بازبینی پیکربندی‌شده را تحویل یا زیرشرح D-02 کنید و در S05 موجود و نیازمند توسعه را جدا کنید."
    },
    {
      "id": "R04",
      "title": "پذیرش و مدیریت تغییر",
      "weight": 10,
      "judge_score": 3,
      "caps": [],
      "final_score": 3,
      "points": 7.5,
      "limited_by_input": false,
      "fix": "در S13 بنویسید اگر مدیر فروش در مهلت بازبینی پاسخ ندهد چه می‌شود و حداکثر چند دور اصلاح و بازآزمون در قیمت گنجانده شده است."
    },
    {
      "id": "R05",
      "title": "فرایند، زمان و نقش‌ها",
      "weight": 10,
      "judge_score": 3,
      "caps": [],
      "final_score": 3,
      "points": 7.5,
      "limited_by_input": false,
      "fix": "در جدول T-01 تا T-03 مشخص کنید مهلت اصلاح پذیرش و زمان پاسخ تأییدکننده داخل مدت مرحله است یا اضافه بر آن، و یک مسیر ارجاع اختلاف بنویسید."
    },
    {
      "id": "R06",
      "title": "قیمت و شرایط تجاری",
      "weight": 15,
      "judge_score": 3,
      "caps": [],
      "final_score": 3,
      "points": 11.25,
      "limited_by_input": false,
      "fix": "رویداد و زمان پرداخت P-03 را بنویسید، وضعیت عددی بودن P-01 و P-02 را در برابر «قیمت نهایی نشده» روشن کنید و سقف API را تا موعد U-01 عدد بگذارید."
    },
    {
      "id": "R07",
      "title": "امنیت، فرض‌ها و ریسک",
      "weight": 10,
      "judge_score": 3,
      "caps": [],
      "final_score": 3,
      "points": 7.5,
      "limited_by_input": false,
      "fix": "در S11 دسته‌ی داده، پردازشگر و روش اطلاع‌رسانی رخداد را بنویسید و در S12 ریسک تأخیر مجموعه‌ی آزمون و ستون احتمال/اثر را اضافه کنید."
    },
    {
      "id": "R08",
      "title": "proof و صداقت ادعا",
      "weight": 5,
      "judge_score": 2,
      "caps": [],
      "final_score": 2,
      "points": 2.5,
      "limited_by_input": false,
      "fix": "نمونه‌ی نمایش‌داده‌شده را نام ببرید، تجربه‌ی قابل‌پیگیری تیم مجری در همین نوع کار را با ادعای دفتر ادعا بنویسید و محدودیت آن را ذکر کنید."
    },
    {
      "id": "R09",
      "title": "نگارش و طراحی و دسترس‌پذیری",
      "weight": 5,
      "judge_score": 3,
      "caps": [],
      "final_score": 3,
      "points": 3.75,
      "limited_by_input": false,
      "fix": "جدول‌های شاخص و پذیرش را به دو جدول باریک‌تر بشکنید یا ستون‌های کم‌کاربرد را به پیوست ببرید و تکرار هزینه و منفعت را در S02 کوتاه کنید."
    },
    {
      "id": "R10",
      "title": "گام بعد و انطباق با دستور مشتری",
      "weight": 5,
      "judge_score": 3,
      "caps": [],
      "final_score": 3,
      "points": 3.75,
      "limited_by_input": false,
      "fix": "در S15 امضاکننده‌ی توافق و سند بعدی (قیمت و برنامه‌ی نهایی) را نام ببرید و بنویسید امضا در چه ترتیبی با PAY-01 و شروع کار قرار دارد."
    }
  ],
  "total": 73.75,
  "veto": [],
  "guide": {
    "pass": false,
    "band": "نیازمند اصلاح",
    "fail_reasons": [
      "total ۷۳٫۷۵ کمتر از حداقل ۸۵"
    ]
  },
  "target": {
    "met": false,
    "threshold": 90.0,
    "score10": 7.375
  },
  "issues": [
    {
      "source": "R01",
      "section": "S02",
      "points_at_stake": 3.75,
      "text": "R01 شناخت و شخصی‌سازی مشتری: نمره ۳ از ۴. در S03 حجم تقریبی پیش‌نویس‌ها و تعداد بازبین‌ها را از صورت‌جلسه بیاورید، یا صریحاً نامعلوم بنویسید و در پیوست نامعلوم‌ها ثبت کنید.",
      "severity": "below_target",
      "id": "I-01"
    },
    {
      "source": "R03",
      "section": "S05",
      "points_at_stake": 3.75,
      "text": "R03 دامنه و تحویل‌دادنی: نمره ۳ از ۴. تعداد نمونه‌های مجموعه‌ی آزمون را در D-01 بنویسید، جریان بازبینی پیکربندی‌شده را تحویل یا زیرشرح D-02 کنید و در S05 موجود و نیازمند توسعه را جدا کنید.",
      "severity": "below_target",
      "id": "I-02"
    },
    {
      "source": "R06",
      "section": "S09",
      "points_at_stake": 3.75,
      "text": "R06 قیمت و شرایط تجاری: نمره ۳ از ۴. رویداد و زمان پرداخت P-03 را بنویسید، وضعیت عددی بودن P-01 و P-02 را در برابر «قیمت نهایی نشده» روشن کنید و سقف API را تا موعد U-01 عدد بگذارید.",
      "severity": "below_target",
      "id": "I-03"
    },
    {
      "source": "R02",
      "section": "S04",
      "points_at_stake": 2.5,
      "text": "R02 نتیجه و معیار سنجش: نمره ۳ از ۴. حداقل تعداد پیش‌نویس برای محاسبه‌ی میانه و موعد توافق هدف (مثلاً پایان T-01) را در جدول شاخص‌ها اضافه کنید.",
      "severity": "below_target",
      "id": "I-04"
    },
    {
      "source": "R04",
      "section": "S10",
      "points_at_stake": 2.5,
      "text": "R04 پذیرش و مدیریت تغییر: نمره ۳ از ۴. در S13 بنویسید اگر مدیر فروش در مهلت بازبینی پاسخ ندهد چه می‌شود و حداکثر چند دور اصلاح و بازآزمون در قیمت گنجانده شده است.",
      "severity": "below_target",
      "id": "I-05"
    },
    {
      "source": "R05",
      "section": "S07",
      "points_at_stake": 2.5,
      "text": "R05 فرایند، زمان و نقش‌ها: نمره ۳ از ۴. در جدول T-01 تا T-03 مشخص کنید مهلت اصلاح پذیرش و زمان پاسخ تأییدکننده داخل مدت مرحله است یا اضافه بر آن، و یک مسیر ارجاع اختلاف بنویسید.",
      "severity": "below_target",
      "id": "I-06"
    },
    {
      "source": "R07",
      "section": "S10",
      "points_at_stake": 2.5,
      "text": "R07 امنیت، فرض‌ها و ریسک: نمره ۳ از ۴. در S11 دسته‌ی داده، پردازشگر و روش اطلاع‌رسانی رخداد را بنویسید و در S12 ریسک تأخیر مجموعه‌ی آزمون و ستون احتمال/اثر را اضافه کنید.",
      "severity": "below_target",
      "id": "I-07"
    },
    {
      "source": "R08",
      "section": "S14",
      "points_at_stake": 2.5,
      "text": "R08 proof و صداقت ادعا: نمره ۲ از ۴. نمونه‌ی نمایش‌داده‌شده را نام ببرید، تجربه‌ی قابل‌پیگیری تیم مجری در همین نوع کار را با ادعای دفتر ادعا بنویسید و محدودیت آن را ذکر کنید.",
      "severity": "below_target",
      "id": "I-08"
    },
    {
      "source": "R09",
      "section": null,
      "points_at_stake": 1.25,
      "text": "R09 نگارش و طراحی و دسترس‌پذیری: نمره ۳ از ۴. جدول‌های شاخص و پذیرش را به دو جدول باریک‌تر بشکنید یا ستون‌های کم‌کاربرد را به پیوست ببرید و تکرار هزینه و منفعت را در S02 کوتاه کنید.",
      "severity": "below_target",
      "id": "I-09"
    },
    {
      "source": "R10",
      "section": "S01",
      "points_at_stake": 1.25,
      "text": "R10 گام بعد و انطباق با دستور مشتری: نمره ۳ از ۴. در S15 امضاکننده‌ی توافق و سند بعدی (قیمت و برنامه‌ی نهایی) را نام ببرید و بنویسید امضا در چه ترتیبی با PAY-01 و شروع کار قرار دارد.",
      "severity": "below_target",
      "id": "I-10"
    }
  ],
  "judges_valid": false,
  "bottom_line": "سند صادق و خوب مستند است ولی هسته‌ی راه‌حل تحویل مشخصی ندارد و هیچ ردیفی هنوز تأیید مالک را ندارد، پس سقف نمره ۳ است.",
  "biggest_weakness": {
    "criterion": "R03",
    "what": "جریان «پیش‌نویس کنار شواهد سرنخ» که راه‌حل اصلی است در هیچ‌یک از D-01 تا D-03 به‌عنوان خروجی نیامده و تعداد نمونه‌های مجموعه‌ی آزمون نامعلوم است.",
    "why": "مشتری ۹۰ میلیون تومان برای پیکربندی و ارزیابی می‌پردازد، ولی D-02 فقط گزارش است و D-03 آموزش جریانی است که تحویل آن تعریف نشده؛ پذیرش و اختلاف بعدی هم مبنای قابل شمارش ندارد.",
    "fix": "جریان بازبینی پیکربندی‌شده را با محیط و تعداد کاربر، و تعداد نمونه‌های مجموعه‌ی آزمون را در D-01 و D-02 بنویسید."
  }
}
